Sheet: Tabelle1
A1: BÄNDERBESTANDSFÜHRUNG
A4: DATUM | B4: EINGANG | C4: ABGANG | D4: BAHN | E4: VORGANG | F4: GRUND | G4: BESTAND
A5: 2009-05-01 | F5: Anfangsbestand | G5: 8
A6: 2009-05-04 | C6: 2 | D6: 5.6 | E6: Wechsel | F6: Verschleiß | G6: of:=SUM([.G5]-[.C6]) -> 6
A7: 2009-09-10 | C7: 6 | D7: 1 bis 6 | E7: Wechsel | F7: Verschleiß/VM | G7: of:=SUM([.G6]-[.C7]) -> 0
A8: 2010-02-15 | B8: 10 | E8: Eingang | F8: Bestellung | G8: of:=SUM([.G7]-[.C8]+[.B8]) -> 10
A9: 2010-02-16 | C9: 4 | D9: 3 bis 6 | E9: Wechsel | F9: Verschleiß/VM | G9: of:=SUM([.G8]-[.C9]+[.B9]) -> 6
A10: 2010-09-07 | C10: 6 | D10: 1 bis 6 | E10: Wechsel | F10: Verschleiß/VM | G10: of:=SUM([.G9]-[.C10]+[.B10]) -> 0
A11: 2010-11-01 | B11: 10 | E11: Eingang | F11: Bestellung | G11: of:=SUM([.G10]-[.C11]+[.B11]) -> 10
A12: 2011-01-03 | C12: 2 | D12: 3.4 | E12: Wechsel | F12: Verschleiß/VM | G12: of:=SUM([.G11]-[.C12]+[.B12]) -> 8
A13: 2011-02-28 | C13: 2 | D13: 5.6 | E13: Wechsel | F13: Verschleiß | G13: of:=SUM([.G12]-[.C13]+[.B13]) -> 6
A14: 2011-03-24 | C14: 2 | D14: 1.2 | E14: Wechsel | F14: Verschleiß/Querschl. | G14: of:=SUM([.G13]-[.C14]+[.B14]) -> 4